Source,Heading,Category,Date,Time,URL,Text
Stanford,Stanford launches major effort to harness the microbiome to treat disease,Science & Technology,2019-08-18,-,https://news.stanford.edu/2019/08/13/stanford-launches-major-effort-harness-microbiome-treat-disease/,"   Stanford is launching a major new effort to harness the communities of microbes inhabiting our bodies – known as the microbiome – in developing new therapies for debilitating diseases. The Stanford Microbiome Therapies Initiative (MITI), a joint initiative between Stanford ChEM-H and the Department of Bioengineering, is backed by a $10 million gift from philanthropists Marc and Lynne Benioff and a $7 million gift from Mark and Debra Leslie.  Michael Fischbach will lead the Stanford Microbiome Therapies Initiative, a joint initiative between ChEM-H and the Department of Bioengineering. (Image credit: L.A. Cicero)  The initiative has an ambitious goal of building and manipulating the microbiome to create new therapies and test them in early-stage human clinical trials. “Microbiome science has great potential for advancing our understanding and treatment of human disease,” said Stanford President Marc Tessier-Lavigne. “Stanford faculty are studying the microbes that inhabit our bodies in health and disease and developing platforms to generate new therapies. This body of work creates a foundation for the Stanford Microbiome Therapies Initiative, which will foster interdisciplinary collaborations across the university to spark discoveries that will benefit patients. I’m thankful to Marc and Lynne Benioff for seeing the potential of this promising field and making a generous gift to inspire other philanthropists, to the deans of the Schools of Medicine and Engineering for their leadership in developing this new initiative, and to Mark and Debra Leslie for joining the Benioffs with their generous support.” The Benioffs announced their lead gift to Stanford along with funding for the University of California, San Francisco to create the UCSF Benioff Center for Microbiome Medicine, which aims to radically rethink the role of the microbiome in early life and develop new interventions to prevent childhood diseases. These gifts further energize the Bay Area’s thriving microbiome research community and leverage the collaborative research in this realm already taking place at the Chan Zuckerberg Biohub, a research institute affiliated with Stanford, UCSF and UC Berkeley. “Lynne and I are honored to support the cutting-edge research of two of the world’s leading universities as they pioneer a new era of microbiome research, science and therapies,” Marc Benioff said. “With a deeper understanding of the human microbiome, our generation can unlock new treatments that impact lives around the world.” Collaborative team MITI is led by Michael Fischbach, associate professor of bioengineering. MITI leverages Stanford’s extensive expertise in microbiome research, the strengths and proximity of Stanford’s Schools of Medicine and Engineering and the interdisciplinary endeavors of Stanford ChEM-H (Chemistry, Engineering and Medicine for Human Health).   Q&A:Michael Fischbach wants to build a microbiome from the ground up. So what do we need to get there? Fischbach explains why the microbiome is worth studying, what his lab is doing to understand the complex communities, and how the people and mission of ChEM-H drew him to Stanford. Read more  Fischbach, who is also the Stanford MAC3 Paul and Mildred Berg Faculty Scholar and the Willard R. and Inez Kerr Bell Faculty Scholar in the School of Engineering, was recruited to Stanford in 2017 through a collaboration between Stanford ChEM-H and the Department of Bioengineering. He brought together a small group of Stanford faculty who were already working to better understand the microbiome. Fischbach proposed forming MITI (pronounced “mighty”) to focus that group’s efforts on manipulating microbial communities – both their composition and their genetics – and engineering those communities into therapies to address a range of diseases. “This initiative is a perfect reflection of the ChEM-H vision of bringing together chemistry, engineering and medicine to revolutionize therapeutic development and to improve human health,” said Carolyn Bertozzi, professor of chemistry and the Baker Family Co-Director of Stanford ChEM-H. “Since its inception, ChEM-H has had a strong interest in microbiome science and medicine and we were thrilled to succeed, in partnership with the Department of Bioengineering, in recruiting Michael Fischbach to ChEM-H to lead a targeted, pioneering initiative in this area.” Bertozzi is also Anne T. and Robert M. Bass Professor in the School of Humanities and Sciences. The initiative draws on a culture at Stanford of working across disciplines to tackle major issues with imaginative solutions, said Kathryn Moler, vice provost and dean of research and the Sapp Family University Fellow in Undergraduate Education. “This initiative couldn’t happen without the involvement and support of the deans of the schools of Medicine and Engineering and a willingness of faculty across campus to step outside their traditional domains and creatively work together to accelerate actionable discoveries and make a tangible impact in human health,” she said. “The team has an ambitious goal and I’m thankful ChEM-H is able to provide a natural home for this initiative to flourish.” Initial funding       Science & Technology Exploring the microbiome frontier This collection of stories about scientists at Stanford reveals the many ways they are learning how the microbiome influences health and how to harness the microbiome to treat disease and improve our overall well-being.    The lead gift from Marc and Lynne Benioff, and the funds provided by Mark and Debra Leslie, will enable the Stanford MITI team to initiate the work needed to construct, manipulate and characterize novel microbial therapies for a range of human diseases. Stanford will seek additional philanthropic support in order to bring promising new therapies to early-stage human clinical trials. Marc Benioff is the chairman, co-chief executive officer and founder of Salesforce. Lynne Benioff is a Distinguished Director of the Board of Overseers of the University of California San Francisco Foundation and serves on the board of directors of the UCSF Benioff Children’s Hospitals, along with several other organizations. Mark Leslie is founder and managing general partner at Leslie Ventures, a private investment company, and a lecturer in management at the Stanford Graduate School of Business. Debra Leslie is a director of the Leslie Family Foundation, whose mission is to positively impact lives through economic development, health care and education, and to support Jewish community life. Focus on therapies   MITI leadership Executive Committee: Carolyn Bertozzi, professor of chemistry; Michael Fischbach, associate professor of bioengineering; Justin Sonnenburg, professor of microbiology & immunology Advisory Committee: Jennifer Doudna, professor of biochemistry and molecular biology, UC Berkeley; Steve Quake, professor of bioengineering and applied physics; Christopher Walsh, emeritus professor, Harvard Medical School Core members: Ami Bhatt, assistant professor of medicine and genetics; Dylan Dodd, assistant professor of pathology and microbiology & immunology; Michael Fischbach, associate professor of bioengineering; KC Huang, professor of bioengineering and microbiology & immunology; David Relman, professor of medicine and microbiology & immunology; Elizabeth Sattely, associate professor of chemical engineering; Justin Sonnenburg, professor of microbiology & immunology  Much of the microbiome research currently underway focuses on sequencing and cataloging communities of microbes in our gut and on our skin – work that has led to discoveries about the role of the microbiome in diseases like inflammatory bowel disease, liver disease, autoimmune disease and cancer. Fischbach said little has been done until now to precisely manipulate those communities or their genomes to explore possibilities for new treatments. Instead, current therapy utilizes human stool: an undefined community of microbes with unknown modes of action and variable therapeutic outcomes. “This groundbreaking research at the intersection of engineering and medicine is precisely what we envisioned when we joined forces with Stanford ChEM-H to recruit Michael Fischbach,” said Jennifer Cochran, who is the Shriram Chair of the Department of Bioengineering. “Achieving this ambitious goal will draw on Stanford’s expertise in engineering novel solutions and experience translating research into new therapies to be tested in humans. I appreciate the support of the schools of Medicine and Engineering and Stanford ChEM-H for their valuable teamwork in forming this new initiative.” The initiative will launch with seven faculty from across engineering and medicine, plus executive and advisory committees to provide expert guidance and is based in part on pioneering work from Alice Cheng, a clinical instructor in gastroenterology at Stanford Medicine. "
Stanford,Race influences professional investors’ judgments,Social Sciences,2019-08-18,-,https://news.stanford.edu/2019/08/12/race-influences-professional-investors-judgments/,"   When a black-led venture capital firm has an impressive track record, it encounters more bias from professional investors, according to new research by Stanford scholars.  Psychology Professor Jennifer Eberhardt is lead author of a new study on how race influences professional investors’ judgments. (Image credit: Nana Kofi Nti)  In a new study led by Stanford psychologist Jennifer L. Eberhardt, in collaboration with the private investment firm Illumen Capital, researchers found that when venture capital funds are managed by a person of color with strong credentials, professional investors judge them more harshly than their white counterparts with identical credentials. These findings, set to be published Aug. 12 in Proceedings of the National Academy of Sciences, suggest that funds led by people of color might paradoxically encounter more obstacles after they have proved themselves to be strong performers, said Eberhardt, who is the Morris M. Doyle Centennial Professor in the School of Humanities and Sciences. “It’s not simply a pipeline problem,” Eberhardt said. “African Americans who are most qualified, those with the best track record, are getting blocked the most.” Co-authors on the paper include Hazel Rose Markus, the Davis-Brack Professor in the Behavioral Sciences; Sarah Lyons-Padilla, a research scientist at SPARQ, a program in the Psychology Department at the School of Humanities and Sciences co-directed by Eberhardt and Markus; and Ashby Monk, executive director of the Stanford Global Projects Center. Examining disparities in investment Professional investors – people who manage money for governments, nonprofits and companies – do not appear to be hiring or investing in professional fund managers with diverse backgrounds, the researchers said, noting previous research that found that fewer than 1.3 percent of the $69.1 trillion in global assets under the four major asset classes – mutual funds, hedge funds, real estate and private equity – are managed by women and people of color. “Given the power and influence of asset allocators – professional investors – it is critical to understand how they deploy capital and make investment decisions,” Monk said. “In today’s market, investments flow through professional money managers before taking root in companies and projects. As such, if asset allocators set incorrect or biased incentives, the entire capitalist system will reflect and reinforce these biases.” To identify any potential racial bias beyond a potential pipeline problem, the researchers asked 180 asset allocators to evaluate four venture capital funds that were led by either black or white men. The professional investors were presented with four one-page summaries of the funds’ credentials and performance history. There were two versions with a black male managing partner leading either a stronger or a weaker team, and two versions with a white male managing partner leading either a stronger or a weaker team. The researchers then asked the investors to rate each firm’s overall performance, investment skills, competency, social fit and their expectations of how much the fund could raise. They also asked the investors how likely they were to take a meeting with the team and begin the investment process. How do investors judge venture capital funds? The researchers found that professional investors rated the stronger white-male-led team marginally higher than the stronger-quality black-male-led team. But when a firm’s credentials were weaker, investors favored the black-led, racially diverse team. However, the professional investors expressed that they were not likely to invest in either of the weaker teams, diverse or otherwise, the researchers said. Another finding to emerge was a disparity between how professional investors judged stronger and the weaker teams. The researchers found that when investors evaluated the white-led teams, they could easily distinguish between the stronger and weaker firms – they assigned the stronger team higher ratings and the weaker team lower ratings. However, this did not hold up for professional investors’ assessments of either of the black-led teams. When investors were asked to rate the black-led teams, they were unable to distinguish between the stronger and weaker black-led teams. “Over 98 percent of the industry is white and male,” Eberhardt said. “One explanation of this finding could be that investors have rarely seen black-led teams. They simply don’t know how to evaluate them.” Taken together, these findings suggest how black-led teams are likely to encounter more bias when their credentials are stronger, the researchers said. The results also suggest that racial disparities in investing are not only a pipeline problem. “While it is important to work on populating the pipeline, we need to think about how to continue supporting diverse teams who have already established themselves as strong performers,” Lyons-Padilla said. “Our results suggest these teams may not receive as much consideration as their white-male-led counterparts.” Leaving money on the table By undervaluing high-performing funds led by people of color or by overvaluing white-male-led funds, investors may not realize they are missing opportunities for higher financial returns, the researchers said. “In fact, asset allocators might be violating their fiduciary obligations (i.e., to generate the highest possible returns for their investors) by not investing in funds led by people of color that could produce returns as high or higher than white-male-led funds,” the researchers write. “Investors should be knowledgeable about successful firms led by people of color,” Markus said. “They can counter their biases by developing specific investment criteria and establishing a transparent process for making decisions.” Other authors on the paper include Radhika Shah, co-president at Stanford Angels & Entrepreneurs. Sid Radhakrishna and Norris A. “Daryn” Dodson IV of Illumen Capital are also co-authors. SPARQ collaborated with Illumen Capital to examine the sources and consequences of gender and racial disparities in investing. Dodson received his MBA from Stanford Graduate School of Business in 2007 and is a member of the GSB’s Management Board. This research was supported by Prudential Financial; the partnership between SPARQ is also supported by the William and Flora Hewlett Foundation. "
Stanford,Gauging trees’ potential to slow global warming,Science & Technology,2019-08-18,-,https://news.stanford.edu/2019/08/12/gauging-trees-potential-slow-global-warming/,"   Like the eponymous character in Shel Silverstein’s classic children’s tale, trees are generous with their gifts, cleaning the air we breathe and slowing the ravages of global warming by absorbing about a quarter of all human-caused carbon dioxide emissions. But this generosity likely can’t last forever in the face of unabated fossil fuel consumption and deforestation. Scientists have long wondered whether trees and plants could reach a breaking point and no longer adequately absorb carbon dioxide.  Trees such as these in Sequoia National Park will continue to absorb carbon dioxide at generous rates through at least the end of the century, a new study finds. (Image credit: Kolibrik/Pixabay)  An international team led by scientists at Stanford University and the Autonomous University of Barcelona finds reason to hope trees will continue to suck up carbon dioxide at generous rates through at least the end of the century. However, the study published Aug. 12 in Nature Climate Change warns that trees can only absorb a fraction of carbon dioxide in the atmosphere and their ability to do so beyond 2100 is unclear. “Keeping fossil fuels in the ground is the best way to limit further warming,” said study lead author César Terrer, a postdoctoral scholar in Earth system science in Stanford’s School of Earth, Energy & Environmental Sciences. “But stopping deforestation and preserving forests so they can grow more is our next-best solution.” Weighing carbon dioxide Carbon dioxide – the dominant greenhouse gas warming the earth – is food for trees and plants. Combined with nutrients like nitrogen and phosphorus, it helps trees grow and thrive. But as carbon dioxide concentrations rise, trees will need extra nitrogen and phosphorus to balance their diet. The question of how much extra carbon dioxide trees can take up, given limitations of these other nutrients, is a critical uncertainty in predicting global warming.  Potential increase in plant biomass in the U.S. for carbon dioxide levels expected in 2100. (Image credit: César Terrer)  “Planting or restoring trees is like putting money in the bank,” said co-author Rob Jackson, the Michelle and Kevin Douglas Provostial Professor in Earth System Science at Stanford. “Extra growth from carbon dioxide is the interest we gain on our balance. We need to know how high the interest rate will be on our carbon investment.” Several individual experiments, such as fumigating forests with elevated levels of carbon dioxide and growing plants in gas-filled chambers, have provided critical data but no definitive answer globally. To more accurately predict the capacity of trees and plants to sequester carbon dioxide in the future, the researchers synthesized data from all elevated carbon dioxide experiments conducted so far – in grassland, shrubland, cropland and forest systems – including ones the researchers directed. Using statistical methods, machine-learning, models and satellite data, they quantified how much soil nutrients and climate factors limit the ability of plants and trees to absorb extra carbon dioxide. Based on global datasets of soil nutrients, they also mapped the potential of carbon dioxide to increase the amount and size of plants in the future, when atmospheric concentrations of the gas could double. Their results show that carbon dioxide levels expected by the end of the century should increase plant biomass by 12 percent, enabling plants and trees to store more carbon dioxide – an amount equivalent to six years of current fossil fuel emissions. The study highlights important partnerships trees forge with soil microbes and fungi to help them take up the extra nitrogen and phosphorus they need to balance their additional carbon dioxide intake. It also emphasizes the critical role of tropical forests, such as those in the Amazon, Congo and Indonesia, as regions with the greatest potential to store additional carbon. “We have already witnessed indiscriminate logging in pristine tropical forests, which are the largest reservoirs of biomass in the planet,” said Terrer, who also has a secondary affiliation with the Institut de Ciència i Tecnologia Ambientals, Universitat Autònoma de Barcelona. “We stand to lose a tremendously important tool to limit global warming.” To read all stories about Stanford science, subscribe to the biweekly Stanford Science Digest. This paper is a contribution to the Global Carbon Project, which Jackson chairs. Jackson is also senior fellow at the Stanford Woods Institute for the Environment and the Precourt Institute for Energy. Co-authors also include Chris Field, the Perry L. McCarty Director of the Stanford Woods Institute for the Environment, the Melvin and Joan Lane Professor for Interdisciplinary Environmental Studies, professor of Earth system science and of biology and senior fellow at the Precourt Institute for Energy; and researchers at the International Institute for Applied Systems, Imperial College London, Macquarie University, Tsinghua University, University of California at Berkeley, Lawrence Berkeley National Laboratory, University of Vienna, University of Antwerp, California Institute of Technology, University of California at Los Angeles, University of Minnesota, Western Sydney University, the Ecological and Forestry Applications Research Centre, Northern Arizona University, Leiden University, James Cook University, University of Idaho, Peking University, Chinese Academy of Sciences, AgResearch, University of Tasmania, United States Department of Agriculture, University of New South Wales, Justus Liebig University of Giessen, University College Dublin, the Smithsonian Tropical Research Institute, Maastricht University, Utrecht University, Wageningen University, Tokyo University of Agriculture and Technology and Hokkaido University. The research was funded by the Natural Environment Research Council (U.K.), the Spanish Ministry of Science, the European Research Council, the Fund for Scientific Research – Flanders (Belgium),the U.S. Department of Energy, NASA, the California Institute of Technology and the Netherlands Organization for Scientific Research.  "
