,Source,Heading,Category,Date,Time,URL,Text,Category_predicted,weights
16,Science Daily,Best of Both Worlds: Asteroids and Massive Mergers,Space & Time,2019-08-16,-,https://www.sciencedaily.com/releases/2019/08/190816092427.htm,"   The University of Arizona's Steward Observatory has partnered with the Catalina Sky Survey, which searches for near-Earth asteroids from atop Mount Lemmon, in an effort dubbed Searches after Gravitational Waves Using ARizona Observatories, or SAGUARO, to find optical counterparts to massive mergers. ""Catalina Sky Survey has all of this infrastructure for their asteroid survey. So we have deployed additional software to take gravitational wave alerts from LIGO (the Laser Interferometer Gravitational-Wave Observatory) and the Virgo interferometer then notify the survey to search an area of sky most likely to contain the optical counterpart,"" said Michael Lundquist, postdoctoral research associate and lead author on the study published today in the Astrophysical Journal Letters. ""Essentially, instead of searching the next section of sky that we would normally, we go off and observe some other area that has a higher probability of containing an optical counterpart of a gravitational wave event,"" said Eric Christensen, Catalina Sky Survey director and Lunar and Planetary Laboratory senior staff scientist. ""The main idea is we can run this system while still maintaining the asteroid search."" The ongoing campaign began in April, and in that month alone, the team was notified of three massive collisions. Because it is difficult to tell the precise location from which the gravitational wave originated, locating optical counterparts can be difficult. According to Lundquist, two strategies are being employed. In the first, teams with small telescopes target galaxies that are at the right approximate distance, according to the gravitational wave signal. Catalina Sky Survey, on the other hand, utilizes a 60-inch telescope with a wide field of view to scan large swaths of sky in 30 minutes. Three alerts, on April 9, 25 and 26, triggered the team's software to search nearly 20,000 objects. Machine learning software then trimmed down the total number of potential optical counterparts to five. The first gravitational wave event was a merger of two black holes, Lundquist said. ""There are some people who think you can get an optical counterpart to those, but it's definitely inconclusive,"" he said. The second event was a merger of two neutron stars, the incredibly dense core of a collapsed giant star. The third is thought to be a merger between a neutron star and a black hole, Lundquist said. While no teams confirmed optical counterparts, the UA team did find several supernovae. They also used the Large Binocular Telescope Observatory to spectroscopically classify one promising target from another group. It was determined to be a supernova and not associated with the gravitational wave event. ""We also found a near-Earth object in the search field on April 25,"" Christensen said. ""That proves right there we can do both things at the same time."" They were able to do this because Catalina Sky Survey has observations of the same swaths of sky going back many years. Many other groups don't have easy access to past photos for comparison, offering the UA team a leg up. ""We have really nice references,"" Lundquist said. ""We subtract the new image from the old image and use that difference to look for anything new in the sky."" ""The process Michael described,"" Christensen said, ""starting with a large number of candidate detections and filtering down to whatever the true detections are, is very familiar. We do that with near-Earth objects, as well."" The team is planning on deploying a second telescope in the hunt for optical counterparts: Catalina Sky Survey's 0.7-meter Schmidt telescope. While the telescope is smaller than the 60-inch telescope, it has an even wider field of view, which allows astronomers to quickly search an even larger chunk of sky. They've also improved their machine learning software to filter out stars that regularly change in brightness. ""Catalina Sky Survey takes hundreds of thousands of images of the sky every year, from multiple telescopes. Our survey telescopes image the entire visible nighttime sky several times per month, then we are looking for one kind of narrow slice of the pie,"" Christensen said. ""So, we've been willing to share the data with whoever wants to use it."" ",Space & Time,0.12013238134687648
17,Science Daily,Fluorescent Glow May Reveal Hidden Life in the Cosmos,Space & Time,2019-08-13,-,https://www.sciencedaily.com/releases/2019/08/190813144510.htm,"   ""Biofluorescent Worlds II: Biological Fluorescence Induced by Stellar UV Flares, a New Temporal Biosignature,"" was published in Monthly Notices of the Royal Astronomical Society. ""This is a completely novel way to search for life in the universe. Just imagine an alien world glowing softly in a powerful telescope,"" said lead author Jack O'Malley-James, a researcher at Cornell's Carl Sagan Institute. ""On Earth, there are some undersea coral that use biofluorescence to render the sun's harmful ultraviolet radiation into harmless visible wavelengths, creating a beautiful radiance. Maybe such life forms can exist on other worlds too, leaving us a telltale sign to spot them,"" said co-author Lisa Kaltenegger, associate professor of astronomy and director of the Carl Sagan Institute Astronomers generally agree that a large fraction of exoplanets -- planets beyond our solar system -- reside in the habitable zone of M-type stars, the most plentiful kinds of stars in the universe. M-type stars frequently flare, and when those ultraviolet flares strike their planets, biofluorescence could paint these worlds in beautiful colors. The next generation of Earth- or space-based telescopes can detect the glowing exoplanets, if they exist in the cosmos. Ultraviolet rays can get absorbed into longer, safer wavelengths through a process called ""photoprotective biofluorescence,"" and that mechanism leaves a specific sign for which astronomers can search. ""Such biofluorescence could expose hidden biospheres on new worlds through their temporary glow, when a flare from a star hits the planet,"" said Kaltenegger. The astronomers used emission characteristics of common coral fluorescent pigments from Earth to create model spectra and colors for planets orbiting active M stars to mimic the strength of the signal and whether it could be detected for life. In 2016, astronomers found a rocky exoplanet named Proxima b -- a potentially habitable world orbiting the active M star Proxima Centauri, Earth's closest star beyond the sun -- that might qualify as a target. Proxima b is also one of the most optimal far-future travel destinations. ""These biotic kinds of exoplanets are very good targets in our search for exoplanets, and these luminescent wonders are among our best bets for finding life on exoplanets,"" O'Malley-James said. Large, land-based telescopes that are being developed now for 10 to 20 years into the future may be able to spot this glow. ""It is a great target for the next generation of big telescopes, which can catch enough light from small planets to analyze it for signs of life, like the Extremely Large Telescope in Chile,"" Kaltenegger said. ",Space & Time,0.11994899033960439
18,Science Daily,James Webb Space Telescope Could Begin Learning About TRAPPIST-1 Atmospheres in a Year,Space & Time,2019-08-13,-,https://www.sciencedaily.com/releases/2019/08/190813170727.htm,"   The study, led by Jacob Lustig-Yaeger, a UW doctoral student in astronomy, finds that the James Webb telescope, set to launch in 2021, might be able to learn key information about the atmospheres of the TRAPPIST-1 worlds even in its first year of operation, unless -- as an old song goes -- clouds get in the way. ""The Webb telescope has been built, and we have an idea how it will operate,"" said Lustig-Yaeger. ""We used computer modeling to determine the most efficient way to use the telescope to answer the most basic question we'll want to ask, which is: Are there even atmospheres on these planets, or not?"" His paper, ""The Detectability and Characterization of the TRAPPIST-1 Exoplanet Atmospheres with JWST,"" was published online in June in the Astronomical Journal. The TRAPPIST-1 system, 39 light-years -- or about 235 trillion miles -- away in the constellation of Aquarius, interests astronomers because of its seven orbiting rocky, or Earth-like, planets. Three of these worlds are in the star's habitable zone -- that swath of space around a star that is just right to allow liquid water on the surface of a rocky planet, thus giving life a chance. The star, TRAPPIST-1, was much hotter when it formed than it is now, which would have subjected all seven planets to ocean, ice and atmospheric loss in the past. ""There is a big question in the field right now whether these planets even have atmospheres, especially the innermost planets,"" Lustig-Yaeger said. ""Once we have confirmed that there are atmospheres, then what can we learn about each planet's atmosphere -- the molecules that make it up?"" Given the way he suggests the James Webb Space Telescope might search, it could learn a lot in fairly short time, this paper finds. Astronomers detect exoplanets when they pass in front of or ""transit"" their host star, resulting in a measurable dimming of starlight. Planets closer to their star transit more frequently and so are somewhat easier to study. When a planet transits its star, a bit of the star's light passes through the planet's atmosphere, with which astronomers can learn about the molecular composition of the atmosphere. Lustig-Yaeger said astronomers can see tiny differences in the planet's size when they look in different colors, or wavelengths, of light. ""This happens because the gases in the planet's atmosphere absorb light only at very specific colors. Since each gas has a unique 'spectral fingerprint,' we can identify them and begin to piece together the composition of the exoplanet's atmosphere."" Lustig-Yaeger said the team's modeling indicates that the James Webb telescope, using a versatile onboard tool called the Near-Infrared Spectrograph, could detect the atmospheres of all seven TRAPPIST-1 planets in 10 or fewer transits -- if they have cloud-free atmospheres. And of course we don't know whether or not they have clouds. If the TRAPPIST-1 planets have thick, globally enshrouding clouds like Venus does, detecting atmospheres might take up to 30 transits. ""But that is still an achievable goal,"" he said. ""It means that even in the case of realistic high-altitude clouds, the James Webb telescope will still be capable of detecting the presence of atmospheres -- which before our paper was not known."" Many rocky exoplanets have been discovered in recent years, but astronomers have not yet detected their atmospheres. The modeling in this study, Lustig-Yaeger said, ""demonstrates that, for this TRAPPIST-1 system, detecting terrestrial exoplanet atmospheres is on the horizon with the James Webb Space Telescope -- perhaps well within its primary five-year mission."" The team found that the Webb telescope may be able to detect signs that the TRAPPIST-1 planets lost large amounts of water in the past, when the star was much hotter. This could leave instances where abiotically produced oxygen -- not representative of life -- fills an exoplanet atmosphere, which could give a sort of ""false positive"" for life. If this is the case with TRAPPIST-1 planets, the Webb telescope may be able to detect those as well. Lustig-Yaeger's co-authors, both with the UW, are astronomy professor Victoria Meadows, who is also principal investigator for the UW-based Virtual Planetary Laboratory; and astronomy doctoral student Andrew Lincowski. The work follows, in part, on previous work by Lincowski modeling possible climates for the seven TRAPPIST-1 worlds. ""By doing this study, we have looked at: What are the best-case scenarios for the James Webb Space Telescope? What is it going to be capable of doing? Because there are definitely going to be more Earth-sized planets found before it launches in 2021."" The research was funded by a grant from the NASA Astrobiology Program's Virtual Planetary Laboratory team, as part of the Nexus for Exoplanet System Science (NExSS) research coordination network. Lustig-Yaeger added: ""It's hard to conceive in theory of a planetary system better suited for James Webb than TRAPPIST-1."" ",Space & Time,0.11991011116976934
19,Science Daily,Near-Earth Asteroid 2006 QV89 Not a Threat for Next Century,Space & Time,2019-08-13,-,https://www.sciencedaily.com/releases/2019/08/190813101956.htm,"   Observations of the near-Earth asteroid 2006 QV89 made on August 11 with the Canada-France-Hawaii Telescope (CFHT) have ruled out any potential future impact threat to Earth by this asteroid for the next century. 2006 QV89 was discovered on August 29, 2006, with a telescope in Arizona, and observations were only possible through September 8, 2006, when the asteroid became unobservable from telescopes on Earth. The orbit determined from these limited observations had significant uncertainty, and it was not possible to rule out the low probability of the asteroid impacting Earth in the future, possibly as early as 2019. Last month, observations with the European Southern Observatory's Very Large Telescope (VLT) in Chile did not find the asteroid where it would have appeared if it was on a trajectory that would impact Earth this September. This ruled out an impact in 2019, but an impact for 2020 remained a possibility, along with nearly two dozen more over the next hundred years, with eight of those in the next decade. ""There is a big difference between knowing where a hazardous asteroid isn't, and knowing where it is,"" said David Tholen, astronomer at the University of Hawai'i's Institute for Astronomy, who led the effort to recover 2006 QV89. This summer provided the first clear opportunity to recover the asteroid since its discovery, but the uncertainty in its position on the sky spanned roughly 30 degrees (60 times the diameter of the moon) in mid-July, growing even larger as the asteroid approached Earth. ""That made the use of a large telescope with a wide-field camera absolutely essential,"" noted Tholen. Only a fraction of that uncertainty region had been imaged with CFHT on July 14, but operations at the existing telescopes were suspended on July 16, due to the protest on Maunakea. ""We found at least a dozen asteroids in the July 14 data that fell close to the region where 2006 QV89 could have been, but the suspension of operations prevented us from confirming which, if any, of those objects was 2006 QV89,"" said Tholen. With access to the Maunakea telescopes blocked, Tholen enlisted the aid of Marco Micheli of the European Space Agency's NEO Coordination Centre in Frascati, Italy. Micheli is a UH graduate who led the effort to rule out the 2019 impact scenario with ESO's VLT. He pointed a telescope in Spain at the position for the best of the candidate objects, but after two hours of data collection, the object at the predicted position could not be convincingly distinguished from electronic noise in the data. It came as a great relief to learn that CFHT would resume operations last weekend. ""Our highest priority target for Saturday night was the best 2006 QV89 candidate, and despite some thin cirrus clouds and a lot of moonlight, we needed only four minutes of data to obtain proof that we had found the right object,"" said Tholen. The International Astronomical Union's Minor Planet Center announced the recovery to the world on Sunday, and the impact monitoring services at the Jet Propulsion Laboratory and the University of Pisa/SpaceDys in Italy immediately began crunching the numbers to update the impact predictions. A little over an hour later, Davide Farnocchia of Center of Near-Earth Object Studies at NASA's Jet Propulsion Laboratory in Pasadena reported that all the impact scenarios for the next century had been eliminated. ""This result is only one example of the telescopes on Maunakea protecting Earth by observing and studying the asteroids that enter Earth's neighborhood,"" said Kelly Fast, manager of the Near Earth Object Observations Program in NASA's Planetary Defense Coordination Office, which supported the observations. Much in the same way that meteorologists use weather satellite imagery to track hurricanes to determine whether they represent a hazard to people and property, astronomers use telescopes to track asteroids near Earth to determine whether they represent an impact hazard. ""A different asteroid, 2019 NX5, got away from us while the Maunakea telescopes were shuttered, which is regrettable,"" Tholen said. ""We are relieved that we were able to catch 2006 QV89 before our window closed. We are even more relieved that it won't impact the Earth."" ",Space & Time,0.11984898364550352
20,Science Daily,Finding a Cosmic Fog Within Shattered Intergalactic Pancakes,Space & Time,2019-08-13,-,https://www.sciencedaily.com/releases/2019/08/190813113452.htm,"   They learned intriguing new details about the dynamics of baryons, the collection of subatomic particles (including protons and neutrons) that accounts for much of the visible matter in the universe. Most baryons reside in the intergalactic medium (IGM), which is the space in-between galaxies where matter is neither bound to nor tugged upon by surrounding systems. In a new study, Yale postdoctoral associate Nir Mandelker and professor Frank C. van den Bosch report on the most detailed simulation ever of a large patch of the IGM. For the first time, they were able to see how cold, dense gas clouds in the IGM organize themselves and react within much larger ""sheets"" or ""pancakes"" of matter in the vastness of space. The findings appear in the Astrophysical Journal Letters. Researchers have tried for years to piece together the structures and properties of the IGM -- in part to test the standard model of Big Bang cosmology, which predicts that 80%-90% of baryons are in the IGM, but also to investigate the IGM's crucial role as the universe's fuel source. ""The reason galaxies are able to form stars continuously is because fresh gas flows into galaxies from the IGM,"" said Mandelker, lead author of the study. ""It is clear that galaxies would run out of gas in very short order if they didn't accrete fresh gas from the IGM."" Yet detecting the IGM's gas has been supremely difficult. Unlike galaxies, which shine brightly in starlight, gas in the IGM is almost never luminous enough to detect directly. Instead, it has to be studied indirectly, through the absorption of background light. Such absorption studies allow researchers to learn about the density and chemical composition of gas clouds; in particular, they're able to find out if star formation in nearby galaxies has polluted the gas with metals (elements heavier than helium). With its new simulation, the Yale team learned quite a lot -- including new properties of those aforementioned sheets of baryons. ""These are flattened distributions of matter, known as 'pancakes,' that extend across many millions of light years across,"" said van den Bosch. ""We found that rather than being smoothly distributed, the gas in these pancakes shatters into what resembles a 'cosmic fog' made up of tiny, discrete clouds of relatively cold and dense gas."" Such dense clouds of gas had been thought to form only in areas of space close to galaxies, where the gas is naturally denser. But the new simulation shows that they also can condense out of the low-density IGM. The researchers said the phenomenon occurs naturally, as the result of an instability triggered by the efficient cooling of the gas. Another aspect of this cosmic fog, based on the Yale simulation, is that it is pristine; it is too far away from any galaxy to be polluted with metals. According to Mandelker, this is significant because it explains recent, puzzling observations of dense, metal-free clouds at large distances from galaxies. Astronomers could not explain this phenomenon, but the new simulation suggests their presence may simply be the outcome of a natural process. ""Our work highlights the importance of properly resolving the properties of gas in the IGM, which is often neglected in favor of better resolving the central galaxies,"" Mandelker said. ""It has been very difficult to understand how the gas in the IGM could possibly become so dense and optically thick, especially when previous generations of cosmological simulations did not reveal any such dense gas in the IGM."" Mandelker is a Tschira Postdoctoral Fellow in a collaborative program in astrophysics operated by Yale and the Heidelberg Institute for Theoretical Studies (HITS). The principal investigators of the program are van den Bosch and Volker Springel of HITS, who is a co-author of the new study. Freeke van de Voort of the Max Planck Institute for Astrophysics also is a co-author of the study. The research was supported by the Klauss Tschira Foundation through the HITS Yale Program in Astrophysics and a grant from NASA. ",Space & Time,0.11893726868772099
