,Source,Heading,Category,Date,Time,URL,Text,Category_predicted,weights
31,Science Daily,"Oil and Water: Better Monitoring Needed to Secure Vital Groundwater Supplies, Researchers Say",Matter & Energy,2019-08-15,-,https://www.sciencedaily.com/releases/2019/08/190815180627.htm,"   ""There's a critical need for long-term -- years to decades -- monitoring for potential contamination of drinking water resources not only from fracking, but also from conventional oil and gas production,"" McIntosh said. Fracking, also known as high-volume hydraulic fracturing (HVHF), is the practice of injecting liquid under high pressure into petroleum-bearing rock formations to produce fractures or cracks that allow recovery of oil and natural gas. But it's a smaller player in the underground water scene. ""The amount of water injected and produced for conventional oil and gas production exceeds that associated with fracking and unconventional production by well over a factor of ten,"" McIntosh said. While groundwater use varies by region in both countries, about 30 per cent of Canadians and more than 45 per cent of Americans depend on the resource for their municipal, domestic, and agricultural needs. In more arid regions of Canada and the United States , surface freshwater supplies are similarly important. The researchers' work appears in an issue paper published in the journal Groundwater. It looks at the relatively new practice of fracking alongside established activities such as enhanced oil recovery (EOR) and saltwater disposal that have been around almost as long as the oil industry itself. As its name implies, EOR involves injecting water into petroleum-bearing rock formations to ""push"" the oil and gas toward extraction wells to enhance production. Saltwater is produced as a by-product of petroleum production, and while it is used for EOR, any excess must be disposed of, typically by injecting it into depleted formations. There are regulations governing the petroleum industry with regard to groundwater, but information about what is happening underground varies by province and state. Some jurisdictions keep excellent data while for others it's virtually nonexistent. Despite this, Ferguson said they can make some observations. ""I think the general conclusions about water use and potential for contamination are correct, but the details are fuzzy in some areas,"" said Ferguson, a researcher with USask's Global Institute for Water Security. ""Alberta probably has better records than most areas and the Alberta Energy Regulator has produced similar numbers to ours for that region. We saw similar trends for other oil and gas producing regions but we need better reporting, record keeping and monitoring."" Both fracking and conventional practices can affect groundwater and surface water used to make up volumes when there isn't enough from other sources to continue petroleum production. McIntosh and Ferguson looked at how much water was and is being injected underground by petroleum industry activities, how they change pressures and water movement underground, and how these practices could contaminate groundwater supplies. They also compared fracking with the older practices. What they found is that there is likely more water now in the petroleum-bearing formations than there was to begin with due to EOR, and this has changed the behaviour of liquids underground. The concern is that this increases the likelihood of contaminated water making its way into aquifers -- the freshwater-bearing formations on which so many communities depend. Potential effects can be felt far from petroleum-producing regions. For example, previous studies show that operation of disposal wells can cause seismic activity detectable from more than 90 kilometres away. Conventional activities, while they use lower pressures, take place over longer periods of time and may allow contamination over greater distances. Another wild card is that there are thousands of active, dormant, and even abandoned wells across North America. Some of these are leaky or improperly decommissioned, providing possible pathways for contamination from petroleum-producing formations into freshwater aquifers. While there is some effort to deal with this problem through organizations such as Alberta's Orphan Well Association, there is little consensus as to the size of the problem. Ferguson said depending which source is cited -- highly speculative based on per-well decommissioning costs -- the price tag ranges from a few billion to a few hundred billion dollars. ""We haven't done enough site investigations and monitoring of groundwater to know what the liability really looks like,"" he said. ""My guess is that some wells probably should be left as is and others are going to need more work to address migration of brines and hydrocarbons from leaks that are decades old."" ",Environment,0.09305027389602391
32,Science Daily,Discovery of a Bottleneck Relief in Photosynthesis May Have a Major Impact on Food Crops,Environment,2019-08-16,-,https://www.sciencedaily.com/releases/2019/08/190816075543.htm,"   ""We tested the effect of increasing the production of the Rieske FeS protein, and found it increases photosynthesis by 10 percent,"" said lead researcher Dr Maria Ermakova from the ARC Centre of Excellence for Translational Photosynthesis (CoETP). ""The Rieske FeS protein belongs to a complex which is like a hose through which electrons flow, so the energy can be used by the carbon engine of the plant. By overexpressing this protein, we have discovered how to release the pressure of the hose, so more electrons can flow, accelerating the photosynthetic process,"" said Dr Ermakova, who works at The Australian National University (ANU) Centre Node. Dr Ermakova, the lead author of the paper published this week in the journal Communications Biology, said that this is the first time that scientists have generated more of the Rieske FeS protein inside plants that use the C4 photosynthesis pathway. Until now, the majority of efforts to improve photosynthesis have been done in species that use C3 photosynthesis, such as wheat and rice, but not a lot has been done in enhancing C4 photosynthesis. This is despite the fact that C4 crop species -- like maize and sorghum -- play a key role in world agriculture, and are already some of the most productive crops in the world. ""These results demonstrate that changing the rate of electron transport enhances photosynthesis in the C4 model species, Setaria viridis, a close relative of maize and sorghum. It is an important proof of concept that helps us enormously to understand more about how C4 photosynthesis works,"" said CoETP's Deputy Director Professor Susanne von Caemmerer, one of the co-authors of this study. The Rieske protein is particularly important in environments with high radiance, where C4 plants grow. Previous research has shown that overexpressing the Rieske protein in C3 plants improves photosynthesis, but more research was needed in C4 plants. ""It is really exciting, as we are now ready to transform this into sorghum and test the effect it has on biomass in a food crop,"" Professor von Caemmerer says. The research is the result of an international collaboration with researchers from the University of Essex in the UK, who are part of the Realizing Increased Photosynthetic Efficiency (RIPE) project. ""This is a great example that we need international collaborations to solve the complex challenges faced in trying to improve crop production,"" said University of Essex researcher Patricia Lopez-Calcagno, who was involved in producing some of the essential genetic components for the plant transformation. ""In the last 30 years, we have learnt a lot about how C4 plants work by making them worse -- by breaking them as part of the process of discovery. However, this is the first example in which we have actually improved the plants,"" says Professor Robert Furbank, Director of the ARC Centre of Excellence for Translational Photosynthesis and one of the authors of the study. ""Our next steps are to assemble the whole protein FeS complex, which has many other components. There is a lot more to do and lots of things about this protein complex we still don't understand. We have reached 10 percent enhancement by overexpressing the Rieske FeS component, but we know we can do better than that,"" says Professor Furbank. This research has been funded by the ARC Centre of Excellence for Translational Photosynthesis, which aims to improve the process of photosynthesis to increase the production of major food crops such as sorghum, wheat and rice. ",Environment,0.09178049248889929
33,Science Daily,Early Species Developed Much Faster Than Previously Thought,Matter & Energy,2019-08-15,-,https://www.sciencedaily.com/releases/2019/08/190815180633.htm,"   She and fellow researchers have narrowed in a specific time during an era known as the Ordovician Radiation, showing that new species actually developed rapidly during a much shorter time frame than previously thought. The Great Biodiversification Event where many new species developed, they argue, happened during the Darriwilian Stage about 465 million years ago. Their research, ""Coordinated biotic and abiotic change during the Great Ordovician Biodiversification Event: Darriwilian assembly of early Paleozoic building blocks,"" was published in Palaeogeography, Palaeoclimatology, Palaeoecology as part of a special issue they are editing on the Great Ordovician Biodiversification Event. New datasets have allowed them to show that what previously looked like species development widespread over time and geography was actually a diversification pulse. Picture a world before the continents as we know them, when most of the land mass was south of the equator, with only small continents and islands in the vast oceans above the tropics. Then picture ice caps forming over the southern pole. As the ice caps form, the ocean recedes and local, isolated environments form around islands and in seas perched atop continents. In those shallow marine environments, new species develop. Then picture the ice caps melting and the oceans rising again, with those new species riding the waves of global diversification to populate new regions. The cycle then repeats producing waves of new species and new dispersals. Lighting the Spark of Diversification The early evolution of animal life on Earth is a complex and fascinating subject. The Cambrian Explosion (between about 540 to 510 million years ago) produced a stunning array of body plans, but very few separate species of each, notes Stigall. But nearly 40 million years later, during the Ordovician Period, this situation changed, with a rapid radiation of species and genera during the Great Ordovician Biodiversification Event. The triggers of the GOBE and processes that promoted diversification have been subject to much debate, but most geoscientists haven't fully considered how changes like global cooling or increased oxygenation would foster increased diversification. A recent review paper by Stigall and an international team of collaborators attempts to provide clarity on these issues. For this study, Stigall teamed up with Cole Edwards (Appalachian State University), a sedimentary geochemist, and fellow paleontologists Christian Mac Ørum Rasmussen (University of Copenhagen) and Rebecca Freeman (University of Kentucky) to analyze how changes to the physical earth system during the Ordovician could have promoted this rapid increase in diversity. In their paper, Stigall and colleagues demonstrate that the main pulse of diversification during the GOBE is temporally restricted and occurred in the Middle Ordovician Darriwilian Stage (about 465 million years ago). Many changes to the physical earth system, including oceanic cooling, increased nutrient availability, and increased atmospheric oxygen accumulate in the interval leading up to the Darriwilian. These physical changes were necessary building blocks, but on their own were not enough to light the spark of diversification. The missing ingredient was a method to alternately connect and isolate populations of species through cycles of vicariance and dispersal. That spark finally occurs in the Darriwilian Stage when ice caps form over the south pole of the Ordovician Earth. The waxing and waning of these ice sheets caused sea level to rise and fall (similar to the Pleistocene), which provided the alternate connection and disconnection needed to facilitate rapid diversity accumulation. Stigall and her collaborators compared this to the assembly of building blocks required to pass a threshold. ",Matter & Energy,0.09154056836348111
34,Science Daily,Tiny GPS Backpacks Uncover the Secret Life of Desert Bats,Environment,2019-08-16,-,https://www.sciencedaily.com/releases/2019/08/190816101004.htm,"   Wildlife tracking has revolutionized the study of animal movement and their behavior. Yet, tracking small, flying animals such as desert bats remained challenging. Now a new generation of miniaturized satellite-based tags is allowing unique insights into the life of these mysterious mammals. Researchers used 1 g GPS devices to reconstruct the movements of yellow-winged bats, one of two false vampire bats occurring in Africa and one of the few desert bats large enough to carrying this innovative technology. ""GPS tags have seen up to now a limited use with insectivorous bats due to weight constraints and low success in data collection -- we achieved great results in tracking such a light species,"" says Irene Conenna, a PhD candidate at the University of Helsinki and the lead author of the study. Future under the changing climate? ""Bats are some of the most successful desert mammals. Powered flight allows them to efficiently track scarce resources and their nocturnal lifestyle buffers them from the baking sun. However, they still struggle to find enough resources during the drier periods of the year,"" says Ricardo Rocha, one of the co-authors of the paper. The study was conducted in Sibiloi National Park, Northern Kenya, along the shores of Lake Turkana, the world's largest desert lake. Researchers placed GPS loggers in 29 bats, 15 in the rainy season and 14 in the dry and, for one week. Their whereabouts were recorded every 30 to 60 minutes every night. This revealed that during dry periods bats used larger home ranges and had extended activity periods, potentially to compensate for a shortage in food resources. Bats comprise roughly one fifth of all mammal species and deserts are home to over 150 bat species. They display wide variation in morphology, foraging behavior, and habitat use, making them an excellent indicator group for assessing how species respond to changes in their habitats. ""The responses exhibited by bats offer important insights into the responses of other taxonomic groups,"" explains Conenna. ""These new miniaturized satellite-based tags now allow us to better understand how increased aridity affects bats foraging efficiency, leading us one step forward to understanding limits in aridity tolerance and impacts of climate change,"" adds Conenna. Deserts around the world are getting warmer and as they warm desert creatures need to cope with even harsher conditions. ""Understanding how animals cope with seasonal changes is key to understand how they might react to the challenges in the horizon. New technological devices, such as miniaturized satellite-based loggers, go a long way to help us in this task.,"" adds Mar Cabeza, senior author of the study, University of Helsinki. ",Environment,0.09136903282725467
35,Stanford,Gauging trees’ potential to slow global warming,Science,2019-08-18,-,https://news.stanford.edu/2019/08/12/gauging-trees-potential-slow-global-warming/,"   Like the eponymous character in Shel Silverstein’s classic children’s tale, trees are generous with their gifts, cleaning the air we breathe and slowing the ravages of global warming by absorbing about a quarter of all human-caused carbon dioxide emissions. But this generosity likely can’t last forever in the face of unabated fossil fuel consumption and deforestation. Scientists have long wondered whether trees and plants could reach a breaking point and no longer adequately absorb carbon dioxide.  Trees such as these in Sequoia National Park will continue to absorb carbon dioxide at generous rates through at least the end of the century, a new study finds. (Image credit: Kolibrik/Pixabay)  An international team led by scientists at Stanford University and the Autonomous University of Barcelona finds reason to hope trees will continue to suck up carbon dioxide at generous rates through at least the end of the century. However, the study published Aug. 12 in Nature Climate Change warns that trees can only absorb a fraction of carbon dioxide in the atmosphere and their ability to do so beyond 2100 is unclear. “Keeping fossil fuels in the ground is the best way to limit further warming,” said study lead author César Terrer, a postdoctoral scholar in Earth system science in Stanford’s School of Earth, Energy & Environmental Sciences. “But stopping deforestation and preserving forests so they can grow more is our next-best solution.” Weighing carbon dioxide Carbon dioxide – the dominant greenhouse gas warming the earth – is food for trees and plants. Combined with nutrients like nitrogen and phosphorus, it helps trees grow and thrive. But as carbon dioxide concentrations rise, trees will need extra nitrogen and phosphorus to balance their diet. The question of how much extra carbon dioxide trees can take up, given limitations of these other nutrients, is a critical uncertainty in predicting global warming.  Potential increase in plant biomass in the U.S. for carbon dioxide levels expected in 2100. (Image credit: César Terrer)  “Planting or restoring trees is like putting money in the bank,” said co-author Rob Jackson, the Michelle and Kevin Douglas Provostial Professor in Earth System Science at Stanford. “Extra growth from carbon dioxide is the interest we gain on our balance. We need to know how high the interest rate will be on our carbon investment.” Several individual experiments, such as fumigating forests with elevated levels of carbon dioxide and growing plants in gas-filled chambers, have provided critical data but no definitive answer globally. To more accurately predict the capacity of trees and plants to sequester carbon dioxide in the future, the researchers synthesized data from all elevated carbon dioxide experiments conducted so far – in grassland, shrubland, cropland and forest systems – including ones the researchers directed. Using statistical methods, machine-learning, models and satellite data, they quantified how much soil nutrients and climate factors limit the ability of plants and trees to absorb extra carbon dioxide. Based on global datasets of soil nutrients, they also mapped the potential of carbon dioxide to increase the amount and size of plants in the future, when atmospheric concentrations of the gas could double. Their results show that carbon dioxide levels expected by the end of the century should increase plant biomass by 12 percent, enabling plants and trees to store more carbon dioxide – an amount equivalent to six years of current fossil fuel emissions. The study highlights important partnerships trees forge with soil microbes and fungi to help them take up the extra nitrogen and phosphorus they need to balance their additional carbon dioxide intake. It also emphasizes the critical role of tropical forests, such as those in the Amazon, Congo and Indonesia, as regions with the greatest potential to store additional carbon. “We have already witnessed indiscriminate logging in pristine tropical forests, which are the largest reservoirs of biomass in the planet,” said Terrer, who also has a secondary affiliation with the Institut de Ciència i Tecnologia Ambientals, Universitat Autònoma de Barcelona. “We stand to lose a tremendously important tool to limit global warming.” To read all stories about Stanford science, subscribe to the biweekly Stanford Science Digest. This paper is a contribution to the Global Carbon Project, which Jackson chairs. Jackson is also senior fellow at the Stanford Woods Institute for the Environment and the Precourt Institute for Energy. Co-authors also include Chris Field, the Perry L. McCarty Director of the Stanford Woods Institute for the Environment, the Melvin and Joan Lane Professor for Interdisciplinary Environmental Studies, professor of Earth system science and of biology and senior fellow at the Precourt Institute for Energy; and researchers at the International Institute for Applied Systems, Imperial College London, Macquarie University, Tsinghua University, University of California at Berkeley, Lawrence Berkeley National Laboratory, University of Vienna, University of Antwerp, California Institute of Technology, University of California at Los Angeles, University of Minnesota, Western Sydney University, the Ecological and Forestry Applications Research Centre, Northern Arizona University, Leiden University, James Cook University, University of Idaho, Peking University, Chinese Academy of Sciences, AgResearch, University of Tasmania, United States Department of Agriculture, University of New South Wales, Justus Liebig University of Giessen, University College Dublin, the Smithsonian Tropical Research Institute, Maastricht University, Utrecht University, Wageningen University, Tokyo University of Agriculture and Technology and Hokkaido University. The research was funded by the Natural Environment Research Council (U.K.), the Spanish Ministry of Science, the European Research Council, the Fund for Scientific Research – Flanders (Belgium),the U.S. Department of Energy, NASA, the California Institute of Technology and the Netherlands Organization for Scientific Research.  ",Environment,0.09073141941363476
36,Science Daily,Could Biological Clocks in Plants Set the Time for Crop Spraying?,Environment,2019-08-16,-,https://www.sciencedaily.com/releases/2019/08/190816075540.htm,"   Just like human jet lag, plants have body clocks that are crucial for their life in a world that has day and night. Plant biological clocks make a crucial contribution to their growth and the responses of crops to their fluctuating environments. In a new paper, published today [Friday 16 August] in the journal Nature Communications, the researchers found that the death of plant tissue and slow-down in growth resulting from the herbicide glyphosate depends upon the time that the herbicide is applied and also the biological clock. Crucially, the biological clock also led to a daily change in the minimum amount of herbicide that is needed to affect the plant, so less herbicide was needed at certain times of day. This provides an opportunity to reduce the quantity of herbicides used, saving farmers time, money and reducing environmental impacts. In medicine, ""chronotherapy"" considers the body clock when deciding the best time to give a medicine or treatment. This new research suggests that a similar approach could be adopted for future agricultural practice, with crop treatments being applied at times that are most appropriate for certain species of weed or crop. By employing a form of agricultural chronotherapy might have a future role in the sustainable intensification of agriculture required to feed the growing population. ",Environment,0.09031578138240498
