,Source,Heading,Category,Date,Time,URL,Text,Category_predicted,weights
48,Stanford,Stanford launches major effort to harness the microbiome to treat disease,Science,2019-08-18,-,https://news.stanford.edu/2019/08/13/stanford-launches-major-effort-harness-microbiome-treat-disease/,"   Stanford is launching a major new effort to harness the communities of microbes inhabiting our bodies – known as the microbiome – in developing new therapies for debilitating diseases. The Stanford Microbiome Therapies Initiative (MITI), a joint initiative between Stanford ChEM-H and the Department of Bioengineering, is backed by a $10 million gift from philanthropists Marc and Lynne Benioff and a $7 million gift from Mark and Debra Leslie.  Michael Fischbach will lead the Stanford Microbiome Therapies Initiative, a joint initiative between ChEM-H and the Department of Bioengineering. (Image credit: L.A. Cicero)  The initiative has an ambitious goal of building and manipulating the microbiome to create new therapies and test them in early-stage human clinical trials. “Microbiome science has great potential for advancing our understanding and treatment of human disease,” said Stanford President Marc Tessier-Lavigne. “Stanford faculty are studying the microbes that inhabit our bodies in health and disease and developing platforms to generate new therapies. This body of work creates a foundation for the Stanford Microbiome Therapies Initiative, which will foster interdisciplinary collaborations across the university to spark discoveries that will benefit patients. I’m thankful to Marc and Lynne Benioff for seeing the potential of this promising field and making a generous gift to inspire other philanthropists, to the deans of the Schools of Medicine and Engineering for their leadership in developing this new initiative, and to Mark and Debra Leslie for joining the Benioffs with their generous support.” The Benioffs announced their lead gift to Stanford along with funding for the University of California, San Francisco to create the UCSF Benioff Center for Microbiome Medicine, which aims to radically rethink the role of the microbiome in early life and develop new interventions to prevent childhood diseases. These gifts further energize the Bay Area’s thriving microbiome research community and leverage the collaborative research in this realm already taking place at the Chan Zuckerberg Biohub, a research institute affiliated with Stanford, UCSF and UC Berkeley. “Lynne and I are honored to support the cutting-edge research of two of the world’s leading universities as they pioneer a new era of microbiome research, science and therapies,” Marc Benioff said. “With a deeper understanding of the human microbiome, our generation can unlock new treatments that impact lives around the world.” Collaborative team MITI is led by Michael Fischbach, associate professor of bioengineering. MITI leverages Stanford’s extensive expertise in microbiome research, the strengths and proximity of Stanford’s Schools of Medicine and Engineering and the interdisciplinary endeavors of Stanford ChEM-H (Chemistry, Engineering and Medicine for Human Health).   Q&A:Michael Fischbach wants to build a microbiome from the ground up. So what do we need to get there? Fischbach explains why the microbiome is worth studying, what his lab is doing to understand the complex communities, and how the people and mission of ChEM-H drew him to Stanford. Read more  Fischbach, who is also the Stanford MAC3 Paul and Mildred Berg Faculty Scholar and the Willard R. and Inez Kerr Bell Faculty Scholar in the School of Engineering, was recruited to Stanford in 2017 through a collaboration between Stanford ChEM-H and the Department of Bioengineering. He brought together a small group of Stanford faculty who were already working to better understand the microbiome. Fischbach proposed forming MITI (pronounced “mighty”) to focus that group’s efforts on manipulating microbial communities – both their composition and their genetics – and engineering those communities into therapies to address a range of diseases. “This initiative is a perfect reflection of the ChEM-H vision of bringing together chemistry, engineering and medicine to revolutionize therapeutic development and to improve human health,” said Carolyn Bertozzi, professor of chemistry and the Baker Family Co-Director of Stanford ChEM-H. “Since its inception, ChEM-H has had a strong interest in microbiome science and medicine and we were thrilled to succeed, in partnership with the Department of Bioengineering, in recruiting Michael Fischbach to ChEM-H to lead a targeted, pioneering initiative in this area.” Bertozzi is also Anne T. and Robert M. Bass Professor in the School of Humanities and Sciences. The initiative draws on a culture at Stanford of working across disciplines to tackle major issues with imaginative solutions, said Kathryn Moler, vice provost and dean of research and the Sapp Family University Fellow in Undergraduate Education. “This initiative couldn’t happen without the involvement and support of the deans of the schools of Medicine and Engineering and a willingness of faculty across campus to step outside their traditional domains and creatively work together to accelerate actionable discoveries and make a tangible impact in human health,” she said. “The team has an ambitious goal and I’m thankful ChEM-H is able to provide a natural home for this initiative to flourish.” Initial funding       Science & Technology Exploring the microbiome frontier This collection of stories about scientists at Stanford reveals the many ways they are learning how the microbiome influences health and how to harness the microbiome to treat disease and improve our overall well-being.    The lead gift from Marc and Lynne Benioff, and the funds provided by Mark and Debra Leslie, will enable the Stanford MITI team to initiate the work needed to construct, manipulate and characterize novel microbial therapies for a range of human diseases. Stanford will seek additional philanthropic support in order to bring promising new therapies to early-stage human clinical trials. Marc Benioff is the chairman, co-chief executive officer and founder of Salesforce. Lynne Benioff is a Distinguished Director of the Board of Overseers of the University of California San Francisco Foundation and serves on the board of directors of the UCSF Benioff Children’s Hospitals, along with several other organizations. Mark Leslie is founder and managing general partner at Leslie Ventures, a private investment company, and a lecturer in management at the Stanford Graduate School of Business. Debra Leslie is a director of the Leslie Family Foundation, whose mission is to positively impact lives through economic development, health care and education, and to support Jewish community life. Focus on therapies   MITI leadership Executive Committee: Carolyn Bertozzi, professor of chemistry; Michael Fischbach, associate professor of bioengineering; Justin Sonnenburg, professor of microbiology & immunology Advisory Committee: Jennifer Doudna, professor of biochemistry and molecular biology, UC Berkeley; Steve Quake, professor of bioengineering and applied physics; Christopher Walsh, emeritus professor, Harvard Medical School Core members: Ami Bhatt, assistant professor of medicine and genetics; Dylan Dodd, assistant professor of pathology and microbiology & immunology; Michael Fischbach, associate professor of bioengineering; KC Huang, professor of bioengineering and microbiology & immunology; David Relman, professor of medicine and microbiology & immunology; Elizabeth Sattely, associate professor of chemical engineering; Justin Sonnenburg, professor of microbiology & immunology  Much of the microbiome research currently underway focuses on sequencing and cataloging communities of microbes in our gut and on our skin – work that has led to discoveries about the role of the microbiome in diseases like inflammatory bowel disease, liver disease, autoimmune disease and cancer. Fischbach said little has been done until now to precisely manipulate those communities or their genomes to explore possibilities for new treatments. Instead, current therapy utilizes human stool: an undefined community of microbes with unknown modes of action and variable therapeutic outcomes. “This groundbreaking research at the intersection of engineering and medicine is precisely what we envisioned when we joined forces with Stanford ChEM-H to recruit Michael Fischbach,” said Jennifer Cochran, who is the Shriram Chair of the Department of Bioengineering. “Achieving this ambitious goal will draw on Stanford’s expertise in engineering novel solutions and experience translating research into new therapies to be tested in humans. I appreciate the support of the schools of Medicine and Engineering and Stanford ChEM-H for their valuable teamwork in forming this new initiative.” The initiative will launch with seven faculty from across engineering and medicine, plus executive and advisory committees to provide expert guidance and is based in part on pioneering work from Alice Cheng, a clinical instructor in gastroenterology at Stanford Medicine. ",Health,0.08641646091786334
49,Science Daily,Research Suggests Glyphosate Lowers pH of Dicamba Spray Mixtures Below Acceptable Levels,Environment,2019-08-15,-,https://www.sciencedaily.com/releases/2019/08/190815125146.htm,"   The study titled, ""Spray Mixture pH as Affected by Dicamba, Glyphosate and Spray Additives,"" was authored by Tom Mueller and Larry Steckel, both professors in the UT Department of Plant Sciences. Their research consisted of four experiments which examined the effect of different components on spray mixture pH, including formulations of dicamba (XtendiMax and Engenia), glyphosate (Roundup PowerMax II and Cornerstone Plus), ammonium sulfate (AMS), and several pH modifiers. According to their data, the addition of glyphosate to XtendiMax and Engenia always decreased the measured pH by anywhere from 1.0 to 2.1 pH units. Averaged across water sources, the pH levels for XtendiMax + Roundup PowerMax were 4.8, while the levels for Engenia + Roundup PowerMax were 4.6. Conversely, when no glyphosate was added to these dicamba formulations the final pH was always above 5.0. ""If pH is the main driver for dicamba volatility, then the substantial pH changes we're seeing from the addition of glyphosate could have profound effects on volatility, as well as herbicide efficacy,"" says Mueller. Many products containing glyphosate are presently approved to be mixed with dicamba before spray applications. Combining herbicides with different modes of action is a common practice among crop producers to control a wider range of weed species. However, based on Mueller and Steckel's research, UT weed experts are discouraging the addition of glyphosate to XtendiMax and Engenia. ""Based on this research, we believe glyphosate in the tank mix could be a culprit in why we're seeing some of the drift in the fields these past three years,"" says Steckel. Dicamba drift has been a hot-button issue in the agricultural community since new and expanded uses for this herbicide were approved in 2017. Off-target dicamba movement, occurring either through physical drift or volatility, has been blamed for the damage of millions of acres of crops, trees and ornamental plants. In an effort to decrease the potential for dicamba drift through volatilization, the Environmental Protection Agency (EPA) added language to the 2019-2020 labels advising applicators to maintain a spray mixture pH above 5.0 while avoiding the addition of products that would further decrease pH. According to Steckel, the lower the spray mixture pH, the higher the probability that dicamba can dissociate to the acid form, which is the most volatile form of the herbicide. Another experiment in the UT Institute of Agriculture study evaluated spray mixture pH levels when AMS was added to dicamba formulations. AMS is commonly added to spray mixtures containing glyphosate to improve weed control effectiveness. However, new-generation dicamba labels have always forbidden the addition of AMS due to volatility concerns. Interestingly, researchers found that while the addition of AMS did always lower dicamba spray mixture pH levels in this study, it did not lower pH levels as much as the addition of glyphosate. ""That was somewhat surprising given the attention AMS has received as a dicamba volatility enhancer,"" says Mueller. ""Now, there could be some other aspects of ammonium sulfate besides pH that are enhancing volatility, but if pH is the main driver, our data would suggest that adding glyphosate, which is currently an approved tank mix partner, would increase dicamba volatility more than the prohibited AMS."" One proposed solution for addressing low pH spray mixtures is adding a pH modifier to the mix. Mueller and Steckel tested three pH modifers: Chempro CP-70, Novus K 20-0-6, and SoyScience. All three products raised the pH levels of the respective mixtures of XtendiMax + Roundup PowerMax and Engenia + Roundup PowerMax above 5.0. ""That is certainly promising,"" says Steckel, ""and the addition of a pH modifier could decrease the probability of dicamba leaving a treated field via volatility. A follow-up study really needs to test that theory. Another question raised by the results of this research -- if you artificially raise the pH are you going to lose the weed control from glyphosate? That topic also needs more research."" Until more research is done, UT weed scientists are recommending leaving glyphosate out of the dicamba spray mixture and adding a graminicide, like Clethodim, for control of grass weed species. ""Glyphosate is an important herbicide with many uses. Despite the continued evolution of glyphosate-resistant weeds, farmers would be lost without glyphosate, as it still provides excellent and economical control of many troublesome weed species,"" says Steckel. ""It just doesn't belong in a tank mix with dicamba."" ",Environment,0.08424853408286705
50,Science Daily,Shedding Light on How the Human Eye Perceives Brightness,Health,2019-08-18,-,https://www.sciencedaily.com/releases/2019/08/190818101642.htm,"   The findings could contribute to more effective therapies for complications that relate to the eye. They can also serve as the basis for developing lighting and display systems. The research was published in Scientific Reports on May 20th, 2019. The back of the human eye is lined with the retina, a layer of various types of cells, called photoreceptors, that respond to different amounts of light. The cells that process a lot of light are called cones and those that process lower levels of light are named rods. Up until recently, researchers have thought that when light struck the retina, rods and cones were the only two kinds of cells that react. Recent discoveries have revealed an entirely new type of cells, called intrinsically photosensitive retinal ganglion cells (ipRGCs). Unlike rods and cones, ipRGCs contain melanopsin, a photopigment that is sensitive to light. While it has been established that ipRGCs are involved in keeping the brain's internal clock in sync with changes in daylight, their importance in the detection of the amount of light had not yet been well understood. ""Until now, the role of retinal melanopsin cells and how they contribute to the perception of the brightness of light have been unclear,"" said Katsunori Okajima, a professor at the Faculty of Environment and Information Sciences, Yokohama National University and one of the authors of the study. ""We've found that melanopsin plays a crucial role on the human ability to see how well-lit the environment is. These findings are redefining the conventional system of light detection that so far has only taken into consideration two variables, namely brightness and the amount of incoming light. Our results suggest that brightness perception should rely on a third variable -- the intensity of a stimulus that targets melanopsin."" In the study, the authors showed how cones and melanopsin combine to allow the perception of brightness. In order to better assess the contribution of melanopsin to the detection of light, the melanopsin's signals were isolated from cones and rods. This separation allowed for more accurate observation of the melanopsin signal alone. Visual stimuli were carefully designed and positioned in order to specifically stimulate the light-sensitive chemical. Also, the researchers used tracking software to measure study participants' pupil diameters under each visual stimulus. This served as a way to determine the relationship between brightness perception and the actual visual stimulus intensity on the retina. The researchers were able to show that the varying brightness levels of an image that was perceived is a sum of the melanopsin response and the response that is generated by the cones. The former is a linear readout and the latter is not. The results also show that melanopsin is not a minor contributor in brightness perception. Rather, it is a crucial player in brightness perception. This work was supported by the Japan Society for the Promotion of Science Grants-in-Aid for Scientific Research (Grant Numbers 15H05926 and 18H04111). ",Health,0.08305016222539856
51,Science Daily,Genetic Redundancy Aids Competition Among Bacteria in Symbiosis With Squid,Environment,2019-08-15,-,https://www.sciencedaily.com/releases/2019/08/190815180629.htm,"   A paper describing the research, which provides insight into the molecular mechanisms of competition among bacteria in a microbiome, appears online in the Journal of Bacteriology. ""Many organisms, including humans, acquire bacteria from their environment,"" said Tim Miyashiro, assistant professor of biochemistry and molecular biology at Penn State and the leader of the research team. ""These bacteria can contribute to functions within the host organism, like how our gut bacteria help us digest food. We are interested in the dynamic interactions among bacterial cells and between bacteria and their host to better understand these mutually beneficial symbiotic relationships."" Cells of a bioluminescent species of marine bacteria, Vibrio fisheri, take up residence in the light organ of a newly hatched bobtail squid. At night, the bacteria produce a blue glow that researchers believe obscures the squid's silhouette and helps protect it from predators. The light organ has pockets, or crypts, in the squid's skin that provide nutrients and a safe environment for the bacteria. ""When the squid hatches, it doesn't yet have any bacteria in its light organ,"" said Miyashiro. ""Bacteria in the environment quickly colonize the squid's light organ. Each crypt can be occupied by several different strains initially. Some of these different bacterial strains can coexist, but others -- bacteria that use the T6SS system -- kill cells of other strains."" In the lab, researchers can control which bacterial strains are present in the environment of the hatching squid and study their interactions. A strain of V. fisheri referred to as FQ-A001 uses the T6SS system. If this strain occupies a crypt with cells of a strain that doesn't use the T6SS system, it can kill those cells and completely take over the crypt. The T6SS system, which is encoded in the genome of many bacteria as a cluster of genes, works almost like a hypodermic needle that can inject toxins into neighboring cells. ""We disabled a gene in the T6SS cluster called hcp to study its role in FQ-A001's ability to kill other bacteria"" said Miyashiro. ""The hcp gene codes for a protein that makes up part of the structure of the T6SS system and also is one of the molecules secreted by the system to kill other cells. We were therefore surprised that the T6SS system still functioned in these bacteria."" The researchers then located another copy of the hcp gene outside of the T6SS gene cluster in the genome of FQ-A001 that coded for an identical protein. Disabling this copy of the gene, called hcp1, also had no impact on the bacteria's ability to kill other cells. But when the researchers disabled both copies of the hcp gene, the T6SS system could no longer function and the FQ-A001 bacteria could coexist with other strains in the light organ of a bobtail squid. The researchers could also rescue T6SS function by inducing Hcp expression in FQ-A001 bacteria with both of its natural copies of hcp disabled. ""The two copies of the hcp gene seem to be completely functionally redundant,"" said Miyashiro. ""Knowing this helps us better understand the molecular mechanisms that underlie the establishment of the symbiotic relationships between bacteria and their hosts."" ",Environment,0.08290805300206197
52,Science Daily,How E. Coli Knows How to Cause the Worst Possible Infection,Health,2019-08-16,-,https://www.sciencedaily.com/releases/2019/08/190816101002.htm,"   The new discovery shows just how the foodborne pathogen knows where and when to begin colonizing the colon on its way to making you sick. By recognizing the low-oxygen environment of the large intestine, the dangerous bacterium gives itself the best odds of establishing a robust infection -- one that is punishing for the host. ""Bacterial pathogens typically colonize a specific tissue in the host. Therefore, as part of their infection strategies, bacterial pathogens precisely time deployment of proteins and toxins to these specific colonization niches in the human host. This allows the pathogens to save energy and avoid detection by our immune systems and ultimately cause disease,"" said researcher Melissa Kendall, PhD, of UVA's Department of Microbiology, Immunology and Cancer Biology. ""By knowing how bacterial pathogens sense where they are in the body, we may one day be able to prevent E. coli, as well as other pathogens, from knowing where it is inside a human host and allow it to pass through the body without causing an infection."" A Bacterial Goldilocks E. coli naturally lives in our colons, and most strains do us no harm. But there are several strains that can cause cramps, diarrhea, vomiting, even kidney failure and death. Children are at particular risk. As such, E. coli outbreaks appear periodically in the news. In July, for example, people in several states were sickened by E. coli linked to ground bison meat. Kendall and graduate student Elizabeth M. Melson have shed important light on how harmful E. coli infections establish themselves in the body. The researchers outlined a process the bacteria use to detect low oxygen levels in the large intestine and then produce proteins that allow E. coli to attach to host cells and establish infection. Oxygen actually diffuses from the intestinal tissue into the gut, and there are comparably higher levels in the small intestine than the large. E. coli specifically waits until it has reached the-low oxygen large intestine before striking. E. coli's vital asset is a small form of RNA that activates particular genes when oxygen levels are low enough, the researchers reveal. It's at this point that the infection really gets established. Thanks to this natural sensing process, the bacteria are able to establish infection and begin to manufacture harmful Shiga toxins. The researchers believe that other bacterial pathogens, such as Shigella and Salmonella, likely employ a similar control mechanism, though more work needs to be done to establish that. ""If scientists can figure how to block oxygen sensing, we may be able to prevent E. coli from making proteins that allow it to stick to our guts,"" Kendall said. ""This may be an effective strategy to limit infection, and because we are not targeting growth or survival, E. coli may not develop drug resistance -- it just doesn't know where it is."" ",Health,0.07792787457524294
